{
  "schema_version": "agent-dispatch.sync-publication/v1",
  "publication_id": "publication-001",
  "group_id": "wiki-pair",
  "publisher": "node-a",
  "state_incarnation_id": "node-a-0001",
  "membership_revision": "1111111111111111111111111111111111111111",
  "content_ref": "refs/heads/wiki-sync",
  "source_revision": 7,
  "base_commit": "1111111111111111111111111111111111111111",
  "snapshot_digest": "sha256:aaaaaaaaaaaaaaaaaaaaaaaaaaaaaaaaaaaaaaaaaaaaaaaaaaaaaaaaaaaaaaaa",
  "scope_digest": "sha256:1e134a9296b8652b4fd887c8be2c2596caee32ac0523f058d516af8fd4958320",
  "contract_digest": "sha256:30cf47b1bd854a0271aa9df3e7b37f0cc14cdd86d3f06a65a2cb787c6741131b",
  "receipt_ids": ["receipt-001"],
  "cause_id": "dispatch-001",
  "state": "prepared",
  "reason": "none",
  "attempts": 0,
  "claim_owner": null,
  "fence": 1,
  "retain_until_resolved": true
}
